game,url
Cyberpunk Legacy (Mod do GTA Vice) PT-BR ISO PS2,https://www.mediafire.com/file/47cloux9u69p69j/Cyberpunk_Legacy_Mod_Do_GTA_Vice_Em_PT-BR_PS2.rar/file
GTA ANIME LEGEND ALPHA 1.1 ISO PS2,https://www.mediafire.com/file/r7pyug69qlwkrj6/GTA_ANIME_LEGEND_BETA.zip/file
GTA Alzeir Salem ISO PS2,https://www.mediafire.com/file/k9p666viq522rox/GTA_Alzeir_Salem_ISO_PS2.rar/file
GTA Dragon Ball Z ISO PS2,https://www.mediafire.com/file/i1q3a4q42mxksos/GTA_Dragon_Ball_Z.iso/file
GTA Dublado PT-BR versão (BETA v1.03) ISO PS2,https://www.mediafire.com/file/twqqdfp790y253l/GTA_Dublado_PT-BR_vers%25C3%25A3o_%2528BETA_v1.03%2529_IOS_PS2.rar/file
GTA FREE FIRE Mod (Pré Alpha) ISO PS2,https://www.mediafire.com/file/wzohg3o3cv1pkbi/GTA_FREE_FIRE_Mod_%2528Pr%25C3%25A9_Alpha%2529_DVD_ISO_PS2.rar/file
GTA GENERATIONS BETA 5.0.4 ISO PS2,https://www.mediafire.com/file/jjb64a5sjjnleiq/BETA_005.22.GTA_GENERATIONS_5.0.4.zip/file
GTA Generations Beta V5 (Última Atualização) ISO PS2,https://www.mediafire.com/file/wivsnre03z624rv/Generations+BETA+5.rar/file
GTA Generations Beta v4 PT-BR ISO PS2,https://www.mediafire.com/file/t3qnj074m2s1tur/GTA_Generations_Beta_v4_PT-BR_DVD_ISO_PS2.rar/file
GTA Generations Beta v5 ISO PS2,https://www.mediafire.com/file/es7ms4foxo61288/GTA_Generations_BETA_5_DVD_ISO_PS2.rar/file
GTA H0t S3x ISO PS2,https://www.mediafire.com/file/876xtmfmit6rzbm/GTTASJEYLSX.rar/file
GTA IV Mod ISO PS2,https://www.mediafire.com/file/b875psh6ll3slh0/GTA_VI_DVD_ISO_PS2.iso/file
GTA IV Mod Legendado PT-BR ISO PS2,https://www.mediafire.com/file/0w2m3kbvls73xji/Gta_IV_Mod_Legenda_PT-BR_DVD_ISO_PS2.rar/file
GTA La Casa De Papel ISO PS2,https://f.s3roms.download/romfiles/77241739693fN%20S%20-%20Ult%20Ni%20Imt%20%28USA%29%20%28En%2CFr%2CEs%29.zip
GTA Mod Phoenix+Kaizo ISO PS2,https://www.mediafire.com/file/mg6pg3w7pzio1k8/GTA_Mod_Phoenix%252BKaizo__DVD_ISO_PS2.rar/file
GTA Mod Super Man ISO PS2,https://mega.nz/file/88RAmAwY#F6msQG9Y508LM_qlhx20p9g1ZhkJ4Fbng98NPjpjWFw
GTA MonteVideo V1.0 ISO PS2,https://www.mediafire.com/file/06s8tvrgihvmzy9/GTA_MonteVideo_Vr.1.0_ISO_PS2.rar/file
GTA Rocinha PT-BR ISO PS2,https://www.mediafire.com/file/1968ylo952djz05/GTA_Rocinha_Legendado__DVD_ISO_Ps2.rar/file
GTA SA Homem Aranha No Way Home ISO PS2,https://www.mediafire.com/file/rzdt31t1i33scrb/GGTSJEYLSRANHA.rar/file
GTA San Andreas (Legendado PT-BR) ISO PS2,https://www.mediafire.com/file/k8h0xfia1e9af51/gta_em_portugues.iso/file
GTA San Andreas Biohazard ISO PS2,https://www.mediafire.com/file/ncsiljkigtm6d5v/GTA_Biohazard_ISO_PS2.rar/file
GTA San Andreas Definitive Edition ISO PS2,https://www.mediafire.com/file/6q6x7oqxljjoe3i/GTA_S._Definitive_Edition_DVD_ISO_PS2.rar/file
GTA San Andreas Misterix ISO PS2,https://www.mediafire.com/file/xzt7zdldbkkrtfd/MISTERIX_v2.zip/file
GTA San Andreas PTMG Edition v2 1 ISO PS2,https://drive.google.com/u/0/uc?id=17EIZR9VPfRohDgp89DLqPChQvC-hIUkO&export=download
GTA San Andreas Remastered ISO PS2,https://www.mediafire.com/file/5t1vggusxoag2aw/GTA_San_Andreas_Remastered.rar/file
GTA San Andreas  Brasil v1.0.1 ISO PS2,https://f.s3roms.download/romfiles/3700129701fN%20S%20-%20Ult%20Ni%20Imt%20%28USA%29%20%28En%2CFr%2CEs%29.zip
GTA Sonic Rings ISO PS2,https://drive.google.com/u/0/uc?id=1rxlCbMULInPnXyOMc9uBwbiL7RHtI09-&export=download
GTA Spider City ISO PS2,https://drive.google.com/u/0/uc?id=1r_SnPbzlt5tt-1sq2LTdhNb0rxgC3O7e&export=download
GTA Tropa de Elite 2 ISO PS2,https://www.mediafire.com/file/phwkliw3nhmeyrc/Gta_Tropa_de_Elite_2.iso/file
GTA Tropa de Elite 2023 ISO PS2,https://drive.google.com/u/0/uc?id=1r91VCZkmbXNWjUzSY7p9_KAVvdyfiF4r&export=download
GTA V Legacy PreAlpha Legenda PT-BR ISO PS2,https://www.mediafire.com/file/87wszrv1vi16vy0/GTA_V_Legacy_PreAlpha_PT-BR_DVD_ISO_PS2.rar/file
GTA V Mod Hack Legenda em Espanhol ISO PS2,http://www.mediafire.com/file/74u9g6816icbu9n/GRAND_THEFT_AUTO_V.rar/file
GTA VI Gta vice city Mod 2024 ISO PS2,https://f.s3roms.download/romfiles/3569985871fN%20S%20-%20Ult%20Ni%20Imt%20%28USA%29%20%28En%2CFr%2CEs%29.zip
GTA Vice City Traduzido PT-BR ISO PS2,https://gamulatorcdn.lavasoft.com/roms/N%20S%20-%20Ult%20Ni%20Imt%20%28USA%29%20%28En%2CFr%2CEs%29.zip
Grand Theft Auto: Gta Mod São Paulo ISO PS2,https://drive.usercontent.google.com/download?id=1P9g-i6k-qlRkkxhZu23UPlGS-k-zgGRR&export=download&authuser=0
Gta Auto San Andreas (v1.03) PT-BR ISO PS2,https://www.mediafire.com/file/k8h0xfia1e9af51/gta_em_portugues.iso/file
